,title,author,link,abstract
33,SECRET SEARCH,"Andrew John, Ian King",https://onlinelibrary.wiley.com/doi/10.1111/iere.12415,"For high‐profile positions, should applicant identities be made public within the organization (“open search”) or kept confidential (“secret search”)? We construct a model where an organization seeks to hire, but where candidates' abilities are private information unless it uses open search. Rejected applicants, under open search, suffer disutility. We find the following: Salaries are lower under secret search, the expected ability of applicants decreases as the posted (open search) salary increases, secret search is preferred by organizations where quality of candidate is relatively unimportant, and organizations will, for some parameter values, choose secret search even when open search is more efficient."
34,STICKY PRICES AND COSTLY CREDIT,"Liang Wang, Randall Wright, Lucy Qian Liu",https://onlinelibrary.wiley.com/doi/10.1111/iere.12416,"We develop a theory of money and credit as competing payment instruments, then put it to work in applications. Agents use cash and credit because the former (latter) is subject to the inflation tax (transaction costs). Frictions that make the choice of payment method interesting also imply equilibrium price dispersion. We derive closed‐form solutions for money demand, and show how to simultaneously account for the price‐change facts, cash–credit shares in micro data, and money‐interest correlations in macro data. The effects of inflation on welfare, price dispersion and markups are discussed, as are nonstationary equilibria with dynamics in the price distribution."
35,"HOUSEHOLD SAVING, FINANCIAL CONSTRAINTS, AND THE CURRENT ACCOUNT IN CHINA","Ayşe İmrohoroğlu, Kai Zhao",https://onlinelibrary.wiley.com/doi/10.1111/iere.12417,"In this article, we present a model that can account for the changes in the current account balance in China since the 2000s. Our results suggest that inadequate insurance through government programs for the elderly and the decline in family insurance due to the one‐child policy led to large increases in the household saving rate. These increases coupled with the financial frictions preventing the household saving from being invested in domestic firms resulted in large current account surpluses until 2008. Relaxation of financial constraints, on the other hand, was responsible for the decline in the current account surplus after 2008."
36,DETECTING AND ANALYZING THE EFFECTS OF TIME‐VARYING PARAMETERS IN DSGE MODELS,"Fabio Canova, Filippo Ferroni, Christian Matthes",https://onlinelibrary.wiley.com/doi/10.1111/iere.12418,"We study how structural parameter variations affect the decision rules and economic inference. We provide diagnostics to detect parameter variations and to ascertain whether they are exogenous or endogenous. A constant parameter model poorly approximates a time‐varying data generating process (DGP), except in a handful of relevant cases. Linear approximations do not produce time‐varying decision rules; higher‐order approximations can do this only if parameter disturbances are treated as decision rule coefficients. Structural responses are time invariant regardless of order of approximation. Adding endogenous variations to the parameter controlling leverage in Gertler and Karadi's model substantially improves the fit of the model."
37,URBAN POPULATION AND AMENITIES: THE NEOCLASSICAL MODEL OF LOCATION,"David Albouy, Bryan A. Stuart",https://onlinelibrary.wiley.com/doi/10.1111/iere.12419,"We develop a neoclassical general equilibrium model to explain cross‐metro variation in population and density. We provide new methods to estimate traded and nontraded productivities, and elasticities of housing and land supply, using density and land area data. From wage and housing cost indices, the model explains half of U.S. density and population variation and finds that quality of life determines location choices more than trade productivity; productivity and factor substitution in housing matter most, but are weak in nicer areas. Relaxing land use regulations would increase population in the West, raising both quality of life and productivity experienced by residents."
38,INVESTIGATING NONNEUTRALITY IN A STATE‐DEPENDENT PRICING MODEL WITH FIRM‐LEVEL PRODUCTIVITY SHOCKS,"Michael Dotsey, Alexander L. Wolman",https://onlinelibrary.wiley.com/doi/10.1111/iere.12420,"In a model with fixed cost of price adjustment and idiosyncratic shocks, two parameterizations match a large set of microeconomic facts, yet display different degrees of nonneutrality. Although there is substantial nonneutrality in both cases, the model does not behave like a time‐dependent model, as changes in the distribution of firms account for roughly a third of the short‐run response of the price level to a monetary shock. We use the model to examine how aggregating firm behavior can generate flat hazards; we also find that a recently developed steady‐state statistic is an imperfect guide to characterizing nonneutrality."
39,JUST A BIG MISUNDERSTANDING? BIAS AND BAYESIAN AFFECTIVE POLARIZATION,Daniel F. Stone,https://onlinelibrary.wiley.com/doi/10.1111/iere.12421,"I present a model of affective polarization—growth in hostility over time between two parties—via quasi‐Bayesian inference. In the model, two agents repeatedly choose actions. Each choice is based on a balance of concerns for private interests and the social good. More weight is put on private interests when an agent's character is intrinsically more self‐serving and when the other agent is believed to be more self‐serving. Each agent Bayesian updates about the other's character, and dislikes the other more when she is perceived as more self‐serving. I characterize the effects on growth in dislike of three biases: a prior bias against the other agent's character, the false consensus bias, and limited strategic thinking. Prior bias against the other's character remains constant or declines over time, and actions do not diverge. The other two biases cause actions to become more extreme over time and repeatedly be “worse” than expected, causing mutual growth in dislike, that is, affective polarization. The magnitude of dislike can become arbitrarily large—even when both players are arbitrarily “good” (unselfish). The results imply that seemingly irrelevant cognitive biases can be an important cause of the devolution of relationships, in politics and beyond, and that subtlety and unawareness of bias can be key factors driving the degree of polarization."
40,SOCIAL INSURANCE AND OCCUPATIONAL MOBILITY,"German Cubas, Pedro Silos",https://onlinelibrary.wiley.com/doi/10.1111/iere.12422,"This article studies how insurance from progressive taxation improves the matching of workers to occupations. We propose an equilibrium dynamic assignment model to illustrate how social insurance encourages mobility. Workers experiment to find their best occupational fit in a process filled with uncertainty. Risk aversion and limited earnings insurance induce workers to remain in unfitting occupations. We estimate the model using microdata from the United States and Germany. Higher earnings uncertainty explains the U.S. higher mobility rate. When workers in the United States enjoy Germany's higher progressivity, mobility rises. Output and welfare gains are large."
41,THE FORMATION OF CONSUMER INFLATION EXPECTATIONS: NEW EVIDENCE FROM JAPAN'S DEFLATION EXPERIENCE,"Jess Diamond, Kota Watanabe, Tsutomu Watanabe",https://onlinelibrary.wiley.com/doi/10.1111/iere.12423,"Using a new data set, we investigate the relationship between the inflation experience and expectations of households in Japan, focusing on the post‐1995 deflationary era. Our first finding is that inflation expectations increase with age. Second, we find that measured inflation rates also increase with age, although age and inflation expectations continue to exhibit a positive correlation even after controlling for the household‐level inflation rate. Analysis suggests that the correlation between age and inflation expectations is driven largely by the correlation between cohort and inflation expectations, which we interpret to represent the effect of historical inflation experience on inflation expectations."
42,EXPLORING THE CONSISTENCY OF HIGHER ORDER RISK PREFERENCES,"Alexander Haering, Timo Heinrich, Thomas Mayrhofer",https://onlinelibrary.wiley.com/doi/10.1111/iere.12424,"This study measures higher order risk preferences and their consistency. We explore the role of country differences, the variation of stakes, and the framing of lotteries. We observe a robust dichotomous pattern of choice behavior in China, the United States, and Germany. The majority of choices are consistent with mixed risk aversion or mixed risk‐loving behavior. We also find this pattern after a 10‐fold increase in the stakes. Finally, our results reveal that this pattern is strengthened if the lotteries are displayed in compound instead of reduced form. In a follow‐up study, we explore potential explanations for this framing effect."
43,WORK HISTORIES AND LIFETIME UNEMPLOYMENT,Iacopo Morchio,https://onlinelibrary.wiley.com/doi/10.1111/iere.12425,"A long‐standing question in economics is how important unobserved differences across workers are for explaining unemployment. I revisit this topic using variation in lifetime unemployment across workers in U.S. data. A comparison of workers often unemployed with the rest shows that although differences in job‐finding rates increase over the course of a career, differences in job‐separation rates are large right from the start. I develop a directed search model with symmetric unobserved heterogeneity, in which agents learn workers' types from their labor market histories, to rationalize these findings. The model cannot match the data if unobserved heterogeneity is neglected."
44,"DYNAMIC STATUS EFFECTS, SAVINGS, AND INCOME INEQUALITY","Evangelos V. Dioikitopoulos, Stephen J. Turnovsky, Ronald Wendner",https://onlinelibrary.wiley.com/doi/10.1111/iere.12426,"This article advances the hypothesis that the intensity of status preferences depends negatively on the average wealth of society (endogenous dynamic status effect), in accordance with empirical evidence. Our theory replicates the contradictory historical facts of an increasing saving rate along with declining returns to capital over time. By affecting the dynamics of the saving rate, the dynamic status effect raises inequality, thereby providing a behavioral mechanism for the observed diverse dynamics of income inequality across countries. In countries in which the dynamic status effect is strong (weak), inequality rises (declines) over time in response to a positive productivity shock."
45,GROWING LIKE SPAIN: 1995–2007,"Manuel García‐Santana, Enrique Moral‐Benito, Josep Pijoan‐Mas, Roberto Ramos",https://onlinelibrary.wiley.com/doi/10.1111/iere.12427,"Measured total factor productivity (TFP) fell in Spain during the boom years of 1995–2007. Using administrative data from the quasi‐universe of firms, we show that there was an increase in misallocation, which was more severe in sectors where connections with public officials are more important for business success. We write and estimate a simple model of cronyism in which heterogeneous firms invest in political connections. Our quantitative exercise concludes that the institutional decline over this period costed 1.9% growth in TFP per year and a 0.8% annual increase in the resources spent by firms in establishing political connections."
46,AN EXPERIMENTAL INVESTIGATION OF COOPERATION IN THE DYNAMIC COMMON POOL GAME,Emanuel Vespa,https://onlinelibrary.wiley.com/doi/10.1111/iere.12428,"This article studies experimentally to what extent subjects can cooperate in a dynamic common pool game, where the stage game changes endogenously. Although efficiency can be supported with strategies that condition on history, the main finding is that it is difficult to cooperate. Even if the incentives to cooperate are large, modal behavior can be rationalized with equilibrium Markov strategies that do not condition on history. The popularity of Markov strategies, however, is decreasing in the incentives to cooperate. The evidence also suggests that strategic uncertainty added by facing stage games that change in time may move play away from efficiency."
47,SELLING IN ADVANCE TO LOSS AVERSE CONSUMERS,"Heiko Karle, Marc Möller",https://onlinelibrary.wiley.com/doi/10.1111/iere.12429,"This article examines the influence of information on market performance in an advance purchase setting. Information reduces the risk that an advance purchase results in a mismatch between consumer preferences and product characteristics. However, information may also raise the number of advance purchases by increasing firms' incentive to offer advance purchase discounts. Accounting for consumers' aversion toward losses/risks turns out to be crucial as it changes our assessment of policies aiming to improve consumers' information: Under monopoly, information can be detrimental both for efficiency and consumer surplus, whereas under competition, information is doubly beneficial because it mitigates intertemporal business stealing."
