,title,author,link,abstract
20,An optimal design for hierarchical generalized group testing,"Yaakov Malinovsky, Gregory Haber, Paul S. Albert",https://onlinelibrary.wiley.com/doi/10.1111/rssc.12409,"Choosing an optimal strategy for hierarchical group testing is an important problem for practitioners who are interested in disease screening with limited resources. For example, when screening for infectious diseases in large populations, it is important to use algorithms that minimize the cost of potentially expensive assays. Black and co‐workers described this as an intractable problem unless the number of individuals to screen is small. They proposed an approximation to an optimal strategy that is difficult to implement for large population sizes. We develop an optimal design with respect to the expected total number of tests that can be obtained by using a novel dynamic programming algorithm. We show that this algorithm is substantially more efficient than the approach that was proposed by Black and co‐workers. In addition, we compare the two designs for imperfect tests. R code is provided for practitioners."
21,A novel regularized approach for functional data clustering: an application to milking kinetics in dairy goats,"C. Denis, E. Lebarbier, C. Lévy‐Leduc, O. Martin, L. Sansonnet",https://onlinelibrary.wiley.com/doi/10.1111/rssc.12404,"Motivated by an application to the clustering of milking kinetics of dairy goats, we propose a novel approach for functional data clustering. This issue is of growing interest in precision livestock farming, which is largely based on the development of data acquisition automation and on the development of interpretative tools to capitalize on high throughput raw data and to generate benchmarks for phenotypic traits. The method that we propose in the paper falls in this context. Our methodology relies on a piecewise linear estimation of curves based on a novel regularized change‐point‐estimation method and on the k‐means algorithm applied to a vector of coefficients summarizing the curves. The statistical performance of our method is assessed through numerical experiments and is thoroughly compared with existing experiments. Our technique is finally applied to milk emission kinetics data with the aim of a better characterization of interanimal variability and towards a better understanding of the lactation process."
22,Generalized partially linear models on Riemannian manifolds,"Amelia Simó, M. Victoria Ibáñez, Irene Epifanio, Vicent Gimeno",https://onlinelibrary.wiley.com/doi/10.1111/rssc.12411,"We introduce generalized partially linear models with covariates on Riemannian manifolds. These models, like ordinary generalized linear models, are a generalization of partially linear models on Riemannian manifolds that allow for scalar response variables with error distribution models other than a normal distribution. Partially linear models are particularly useful when some of the covariates of the model are elements of a Riemannian manifold, because the curvature of these spaces makes it difficult to define parametric models. The model was developed to address an interesting application: the prediction of children's garment fit based on three‐dimensional scanning of their bodies. For this reason, we focus on logistic and ordinal models and on the important and difficult case where the Riemannian manifold is the three‐dimensional case of Kendall's shape space. An experimental study with a well‐known three‐dimensional database is carried out to check the goodness of the procedure. Finally, it is applied to a three‐dimensional database obtained from an anthropometric survey of the Spanish child population. A comparative study with related techniques is carried out."
23,A Bayesian group sequential small n sequential multiple‐assignment randomized trial,"Yan‐Cheng Chao, Thomas M. Braun, Roy N. Tamura, Kelley M. Kidwell",https://onlinelibrary.wiley.com/doi/10.1111/rssc.12406,"A small n, sequential, multiple‐assignment, randomized trial (called ‘snSMART’) is a small sample multistage design where participants may be rerandomized to treatment on the basis of intermediate end points. This design is motivated by the ‘A randomized multicenter study for isolated skin vasculitis’ trial (NCT02939573): an on‐going snSMART design focusing on the evaluation of three drugs for isolated skin vasculitis. By formulating an interim decision rule for removing one of the treatments, we use a Bayesian model and the resulting posterior distributions to provide sufficient evidence that one treatment is inferior to the other treatments before enrolling more participants. By doing so, we can remove the worst performing treatment at an interim analysis and prevent the subsequent participants from receiving the removed treatment. On the basis of simulation results, we have evidence that the treatment response rates can still be unbiasedly and efficiently estimated in our new design, especially for the treatments with higher response rates. In addition, by adjusting the decision rule criteria for the posterior probabilities, we can control the probability of incorrectly removing an effective treatment."
24,A spatially varying distributed lag model with application to an air pollution and term low birth weight study,"Joshua L. Warren, Thomas J. Luben, Howard H. Chang",https://onlinelibrary.wiley.com/doi/10.1111/rssc.12407,"Distributed lag models have been used to identify critical pregnancy periods of exposure (i.e. critical exposure windows) to air pollution in studies of pregnancy outcomes. However, much of the previous work in this area has ignored the possibility of spatial variability in the lagged health effect parameters that may result from exposure characteristics and/or residual confounding. We develop a spatially varying Gaussian process model for critical windows called ‘SpGPCW’ and use it to investigate geographic variability in the association between term low birth weight and average weekly concentrations of ozone and PM2.5 during pregnancy by using birth records from North Carolina. SpGPCW is designed to accommodate areal level spatial correlation between lagged health effect parameters and temporal smoothness in risk estimation across pregnancy. Through simulation and a real data application, we show that the consequences of ignoring spatial variability in the lagged health effect parameters include less reliable inference for the parameters and diminished ability to identify true critical window sets, and we investigate the use of existing Bayesian model comparison techniques as tools for determining the presence of spatial variability. We find that exposure to PM2.5 is associated with elevated term low birth weight risk in selected weeks and counties and that ignoring spatial variability results in null associations during these periods. An R package (SpGPCW) has been developed to implement the new method."
25,The harmonic mean χ2‐test to substantiate scientific findings,Leonhard Held,https://onlinelibrary.wiley.com/doi/10.1111/rssc.12410,"Statistical methodology plays a crucial role in drug regulation. Decisions by the US Food and Drug Administration or European Medicines Agency are typically made based on multiple primary studies testing the same medical product, where the two‐trials rule is the standard requirement, despite shortcomings. A new approach is proposed for this task based on the harmonic mean of the squared study‐specific test statistics. Appropriate scaling ensures that, for any number of independent studies, the null distribution is a χ2‐distribution with 1 degree of freedom. This gives rise to a new method for combining one‐sided p‐values and calculating confidence intervals for the overall treatment effect. Further properties are discussed and a comparison with the two‐trials rule is made, as well as with alternative research synthesis methods. An attractive feature of the new approach is that a claim of success requires each study to be convincing on its own to a certain degree depending on the overall level of significance and the number of studies. The new approach is motivated by and applied to data from five clinical trials investigating the effect of carvedilol for the treatment of patients with moderate to severe heart failure."
26,Issue Information,no author,https://onlinelibrary.wiley.com/doi/10.1111/rssc.12359,no abstract
27,Modelling the spatial extent and severity of extreme European windstorms,"Paul Sharkey, Jonathan A. Tawn, Simon J. Brown",https://onlinelibrary.wiley.com/doi/10.1111/rssc.12391,"Windstorms are a primary natural hazard affecting Europe that are commonly linked to substantial property and infrastructural damage and are responsible for the largest spatially aggregated financial losses. Such extreme winds are typically generated by extratropical cyclone systems originating in the North Atlantic and passing over Europe. Previous statistical studies tend to model extreme winds at a given set of sites, corresponding to inference in an Eulerian framework. Such inference cannot incorporate knowledge of the life cycle and progression of extratropical cyclones across the region and is forced to make restrictive assumptions about the extremal dependence structure. We take an entirely different approach which overcomes these limitations by working in a Lagrangian framework. Specifically, we model the development of windstorms over time, preserving the physical characteristics linking the windstorm and the cyclone track, the path of local vorticity maxima, and make a key finding that the spatial extent of extratropical windstorms becomes more localized as its magnitude increases irrespective of the location of the storm track. Our model allows simulation of synthetic windstorm events to derive the joint distributional features over any set of sites giving physically consistent extrapolations to rarer events. From such simulations improved estimates of this hazard can be achieved in terms of both intensity and area affected."
28,The analysis of transformations for profit‐and‐loss data,"Anthony C. Atkinson, Marco Riani, Aldo Corbellini",https://onlinelibrary.wiley.com/doi/10.1111/rssc.12389,"We analyse data on the performance of investment funds, 99 out of 309 of which report a loss, and on the profitability of 1405 firms, 407 of which report losses. The problem in both cases is to use regression to predict performance from sets of explanatory variables. In one case, it is clear from scatter plots of the data that the negative responses have a lower variance than the positive responses and a different relationship with the explanatory variables. Because the data include negative responses, the Box–Cox transformation cannot be used. We develop a robust version of an extension to the Yeo–Johnson transformation which allows different transformations for positive and negative responses. Tests and graphical methods from our robust analysis enable the detection of outliers, the assessment of values of the two transformation parameters and the building of simple regression models. Performance comparisons are made with non‐parametric transformations."
29,Efficient data augmentation for multivariate probit models with panel data: an application to general practitioner decision making about contraceptives,"Vincent Chin, David Gunawan, Denzil G. Fiebig, Robert Kohn, Scott A. Sisson",https://onlinelibrary.wiley.com/doi/10.1111/rssc.12393,"The paper considers the problem of estimating a multivariate probit model in a panel data setting with emphasis on sampling a high dimensional correlation matrix and improving the overall efficiency of the data augmentation approach. We reparameterize the correlation matrix in a principled way and then carry out efficient Bayesian inference by using Hamiltonian Monte Carlo sampling. We also propose a novel antithetic variable method to generate samples from the posterior distribution of the random effects and regression coefficients, resulting in significant gains in efficiency. We apply the methodology by analysing stated preference data obtained from Australian general practitioners evaluating alternative contraceptive products. Our analysis suggests that the joint probability of discussing combinations of contraceptive products with a patient shows medical practice variation among the general practitioners, which indicates some resistance even to discuss these products, let alone to recommend them."
30,Bayesian protein sequence and structure alignment,"Christopher J. Fallaize, Peter J. Green, Kanti V. Mardia, Stuart Barber",https://onlinelibrary.wiley.com/doi/10.1111/rssc.12394,"The structure of a protein is crucial in determining its functionality and is much more conserved than sequence during evolution. A key task in structural biology is to compare protein structures to determine evolutionary relationships, to estimate the function of newly discovered structures and to predict unknown structures. We propose a Bayesian method for protein structure alignment, with the prior on alignments based on functions which penalize ‘gaps’ in the aligned sequences. We show how a broad class of penalty functions fits into this framework, and how the resulting posterior distribution can be efficiently sampled. A commonly used gap penalty function is shown to be a special case, and we propose a new penalty function which alleviates an undesirable feature of the commonly used penalty. We illustrate our method on benchmark data sets and find that it competes well with popular tools from computational biology. Our method has the benefit of being able potentially to explore multiple competing alignments and to quantify their merits probabilistically. The framework naturally enables further information such as amino acid sequence to be included and could be adapted to other situations such as flexible proteins or domain swaps."
31,Estimating seal pup production in the Greenland Sea by using Bayesian hierarchical modelling,"Martin Jullum, Thordis Thorarinsdottir, Fabian E. Bachl",https://onlinelibrary.wiley.com/doi/10.1111/rssc.12397,"The Greenland Sea is an important breeding ground for harp and hooded seals. Estimates of annual seal pup production are critical factors in the estimation of abundance that is needed for management of the species. These estimates are usually based on counts from aerial photographic surveys. However, only a minor part of the whelping region can be photographed, because of its large extent. To estimate total seal pup production, we propose a Bayesian hierarchical modelling approach motivated by viewing the seal pup appearances as a realization of a log‐Gaussian Cox process by using covariate information from satellite imagery as a proxy for ice thickness. For inference, we utilize the stochastic partial differential equation module of the integrated nested Laplace approximation framework. In a case‐study using survey data from 2012, we compare our results with existing methodology in a comprehensive cross‐validation study. The results of the study indicate that our method improves local estimation performance, and that the increased uncertainty of prediction of our method is required to obtain calibrated count predictions. This suggests that the sampling density of the survey design may not be sufficient to obtain reliable estimates of seal pup production."
32,"Estimation and inference in mixed effect regression models using shape constraints, with application to tree height estimation","Xiyue Liao, Mary C. Meyer",https://onlinelibrary.wiley.com/doi/10.1111/rssc.12388,"Estimation of tree height given diameter is an important part of the forest inventory analysis of the US Forest Service. Existing methods use parametric models to estimate the curve. We propose a semiparametric model in which  log (height) is a smooth, increasing and concave function of diameter, with a random‐plot component and fixed effect covariates. Large sample properties and inference methods that work well in practice are derived. Proposed inference methods use approximate normal distributions for the fixed effects and a likelihood ratio test for the significance of the random effect. A closed form approximate prediction method is provided and overall it outperformed competitors for both a simulation and a real data application. The methods are implemented by the cgamm routine in the R package cgam and can be used for a wide range of mixed model applications."
33,Modelling environmental DNA data; Bayesian variable selection accounting for false positive and false negative errors,"Jim E. Griffin, Eleni Matechou, Andrew S. Buxton, Dimitrios Bormpoudakis, Richard A. Griffiths",https://onlinelibrary.wiley.com/doi/10.1111/rssc.12390,"Environmental DNA is a survey tool with rapidly expanding applications for assessing the presence of a species at surveyed sites. Environmental DNA methodology is known to be prone to false negative and false positive errors at the data collection and laboratory analysis stages. Existing models for environmental DNA data require augmentation with additional sources of information to overcome identifiability issues of the likelihood function and do not account for environmental covariates that predict the probability of species presence or the probabilities of error. We present a novel Bayesian model for analysing environmental DNA data by proposing informative prior distributions for logistic regression coefficients that enable us to overcome parameter identifiability, while performing efficient Bayesian variable selection. Our methodology does not require the use of transdimensional algorithms and provides a general framework for performing Bayesian variable selection under informative prior distributions in logistic regression models."
34,Using Cox regression to develop linear rank tests with zero‐inflated clustered data,"Stuart R. Lipsitz, Garrett M. Fitzmaurice, Debajyoti Sinha, Alexander P. Cole, Christian P. Meyer, Quoc‐Dien Trinh",https://onlinelibrary.wiley.com/doi/10.1111/rssc.12396,"Zero‐inflated data arise in many fields of study. When comparing zero‐inflated data between two groups with independent subjects, a 2 degree‐of‐freedom test has been developed, which is the sum of a 1 degree‐of‐freedom Pearson χ2‐test for the 2×2 table of group versus dichotomized outcome (0,>0) and a 1 degree‐of‐freedom Wilcoxon rank sum test for the values of the outcome ‘>0’. Here, we extend this 2 degrees‐of‐freedom test to clustered data settings. We first propose the use of an estimating equations score statistic from a time‐varying weighted Cox regression model under naive independence, with a robust sandwich variance estimator to account for clustering. Since our proposed test statistics can be put in the framework of a Cox model, to gain efficiency over naive independence, we apply a generalized estimating equations Cox model with a non‐independence ‘working correlation’ between observations in a cluster. The methods proposed are applied to a General Social Survey study of days with mental health problems in a month, in which 52.3% of subjects report that they have no days with problems: a zero‐inflated outcome. A simulation study is used to compare our proposed test statistics with previously proposed zero‐inflated test statistics."
35,Assessing heterogeneity in transition propensity in multistate capture–recapture data,"Anita Jeyam, Rachel McCrea, Roger Pradel",https://onlinelibrary.wiley.com/doi/10.1111/rssc.12392,"Multistate capture–recapture models are a useful tool to help to understand the dynamics of movement within discrete capture–recapture data. The standard multistate capture–recapture model, however, relies on assumptions of homogeneity within the population with respect to survival, capture and transition probabilities. There are many ways in which this model can be generalized so some guidance on what is really needed is highly desirable. Within the paper we derive a new test that can detect heterogeneity in transition propensity and show its good power by using simulation and application to a Canada goose data set. We also demonstrate that existing tests which have traditionally been used to diagnose memory are in fact sensitive to other forms of transition heterogeneity and we propose modified tests which can distinguish between memory and other forms of transition heterogeneity."
36,A flexible parametric modelling framework for survival analysis,"Kevin Burke, M. C. Jones, Angela Noufaily",https://onlinelibrary.wiley.com/doi/10.1111/rssc.12398,"We introduce a general, flexible, parametric survival modelling framework which encompasses key shapes of hazard functions (constant; increasing; decreasing; up then down; down then up) and various common survival distributions (log‐logistic; Burr type XII; Weibull; Gompertz) and includes defective distributions (cure models). This generality is achieved by using four distributional parameters: two scale‐type parameters—one of which relates to accelerated failure time (AFT) modelling; the other to proportional hazards (PH) modelling—and two shape parameters. Furthermore, we advocate ‘multiparameter regression’ whereby more than one distributional parameter depends on covariates—rather than the usual convention of having a single covariate‐dependent (scale) parameter. This general formulation unifies the most popular survival models, enabling us to consider the practical value of possible modelling choices. In particular, we suggest introducing covariates through just one or other of the two scale parameters (covering AFT and PH models), and through a ‘power’ shape parameter (covering more complex non‐AFT or non‐PH effects); the other shape parameter remains covariate independent and handles automatic selection of the baseline distribution. We explore inferential issues and compare with alternative models through various simulation studies, with particular focus on evidence concerning the need, or otherwise, to include both AFT and PH parameters. We illustrate the efficacy of our modelling framework by using data from lung cancer, melanoma and kidney function studies. Censoring is accommodated throughout."
37,Bayesian hierarchical modelling of growth curve derivatives via sequences of quotient differences,"Garritt L. Page, María Xosé Rodríguez‐Álvarez, Dae‐Jin Lee",https://onlinelibrary.wiley.com/doi/10.1111/rssc.12399,"Growth curve studies are typically conducted to evaluate differences between group or treatment‐specific curves. Most analyses focus solely on the growth curves, but it has been argued that the derivative of growth curves can highlight differences between groups that may be masked when considering the raw curves only. Motivated by the desire to estimate derivative curves hierarchically, we introduce a new sequence of quotient differences (empirical derivatives) which, among other things, are well behaved near the boundaries compared with other sequences in the literature. Using the sequence of quotient differences, we develop a Bayesian method to estimate curve derivatives in a multilevel setting (a common scenario in growth studies) and show how the method can be used to estimate individual and group derivative curves and to make comparisons. We apply the new methodology to data collected from a study conducted to explore the effect that radiation‐based therapies have on growth in female children diagnosed with acute lymphoblastic leukaemia."
38,Factor‐augmented Bayesian cointegration models: a case‐study on the soybean crush spread,"Maciej Marowka, Gareth W. Peters, Nikolas Kantas, Guillaume Bagnarosa",https://onlinelibrary.wiley.com/doi/10.1111/rssc.12395,"We investigate how vector auto‐regressive models can be used to study the soybean crush spread. By crush spread we mean a time series marking the difference between a weighted combination of the value of soymeal and soyoil to the value of the original soybeans. Commodity industry practitioners often use fixed prescribed values for these weights, which do not take into account any time‐varying effects or any financial‐market‐based dynamic features that can be discerned from futures price data. We address this issue by proposing an appropriate time series model with cointegration. Our model consists of an extension of a particular vector auto‐regressive model that is used widely in econometrics. Our extensions are inspired by the problem at hand and allow for a time‐varying covariance structure and a time‐varying intercept to account for seasonality. To perform Bayesian inference we design an efficient Markov chain Monte Carlo algorithm, which is based on the approach of Koop and his co‐workerss. Our investigations on prices obtained from futures contracts data confirmed that the added features in our model are useful in reliable statistical determination of the crush spread. Although the interest here is on the soybean crush spread, our approach is applicable also to other tradable spreads such as oil and energy‐based crack and spark spreads."
39,Issue Information,no author,https://onlinelibrary.wiley.com/doi/10.1111/rssc.12358,no abstract
