,title,author,link,abstract
0,Issue Information,no author,https://onlinelibrary.wiley.com/doi/10.1111/rssc.12361,no abstract
1,Longitudinal networks of dyadic relationships using latent trajectories: evidence from the European interbank market,"Federica Bianchi, Francesco Bartolucci, Stefano Peluso, Antonietta Mira",https://onlinelibrary.wiley.com/doi/10.1111/rssc.12413,"Financial markets are ultimately seen as a collection of dyadic transactions. We study the temporal evolution of dyadic relationships in the European interbank market, as induced by monetary transactions registered in the electronic market for interbank deposits (e‐MID) during a period of 10 years (2006–2015). In particular, we keep track of how reciprocal exchange patterns have varied with macro events and exogenous shocks and with the emergence of the Global Financial Crisis in 2008. The approach adopted extends the model of Holland and Leinhardt to a longitudinal setting where individuals’ temporal trajectories for the tendency to connect and reciprocate transactions are explicitly modelled through splines or polynomials, and individual‐specific parameters. We estimate the model by an iterative algorithm that maximizes the log‐likelihood for every ordered pair of units. The empirical application shows that the methodology proposed may be applied to large networks and represents the process of exchange at a fine‐grained level. Further results are available in on‐line supplementary material."
2,Causal mechanism of extreme river discharges in the upper Danube basin network,"Linda Mhalla, Valérie Chavez‐Demoulin, Debbie J. Dupuis",https://onlinelibrary.wiley.com/doi/10.1111/rssc.12415,"Extreme hydrological events in the Danube river basin may severely impact human populations, aquatic organisms and economic activity. One often characterizes the joint structure of extreme events by using the theory of multivariate and spatial extremes and its asymptotically justified models. There is interest, however, in cascading extreme events and whether one event causes another. We argue that an improved understanding of the mechanism underlying severe events is achieved by combining extreme value modelling and causal discovery. We construct a causal inference method relying on the notion of the Kolmogorov complexity of extreme conditional quantiles. Tail quantities are derived by using multivariate extreme value models, and causal‐induced asymmetries in the data are explored through the minimum description length principle. Our method CausEV for causality for extreme values uncovers causal relationships between summer extreme river discharges in the upper Danube basin and finds significant causal links between the Danube and its Alpine tributary Lech."
3,Inference for extreme values under threshold‐based stopping rules,"Anna Maria Barlow, Chris Sherlock, Jonathan Tawn",https://onlinelibrary.wiley.com/doi/10.1111/rssc.12420,"There is a propensity for an extreme value analysis to be conducted as a consequence of a large flooding event. This timing of the analysis introduces bias and poor coverage probabilities into the associated risk assessments and leads subsequently to inefficient flood protection schemes. We explore these problems through studying stochastic stopping criteria and propose new likelihood‐based inferences that mitigate against these difficulties. Our methods are illustrated through the analysis of the river Lune, following its experiencing the UK's largest ever measured flow event in 2015. We show that without accounting for this stopping feature there would be substantial overdesign in response to the event."
4,"A hybrid approach for the stratified mark‐specific proportional hazards model with missing covariates and missing marks, with application to vaccine efficacy trials","Yanqing Sun, Li Qi, Fei Heng, Peter B. Gilbert",https://onlinelibrary.wiley.com/doi/10.1111/rssc.12417,"Deployment of the recently licensed tetravalent dengue vaccine based on a chimeric yellow fever virus, CYD‐TDV, requires understanding of how the risk of dengue disease in vaccine recipients depends jointly on a host biomarker measured after vaccination (neutralization titre—neutralizing antibodies) and on a ‘mark’ feature of the dengue disease failure event (the amino acid sequence distance of the dengue virus to the dengue sequence represented in the vaccine). The CYD14 phase 3 trial of CYD‐TDV measured neutralizing antibodies via case–cohort sampling and the mark in dengue disease failure events, with about a third missing marks. We addressed the question of interest by developing inferential procedures for the stratified mark‐specific proportional hazards model with missing covariates and missing marks. Two hybrid approaches are investigated that leverage both augmented inverse probability weighting and nearest neighbourhood hot deck multiple imputation. The two approaches differ in how the imputed marks are pooled in estimation. Our investigation shows that nearest neighbourhood hot deck imputation can lead to biased estimation without properly selected neighbourhoods. Simulations show that the hybrid methods developed perform well with unbiased nearest neighbourhood hot deck imputations from proper neighbourhood selection. The new methods applied to CYD14 show that neutralizing antibody level is strongly inversely associated with the risk of dengue disease in vaccine recipients, more strongly against dengue viruses with shorter distances."
5,Global household energy model: a multivariate hierarchical approach to estimating trends in the use of polluting and clean fuels for cooking,"Oliver Stoner, Gavin Shaddick, Theo Economou, Sophie Gumy, Jessica Lewis, Itzel Lucio, Giulia Ruggeri, Heather Adair‐Rohani",https://onlinelibrary.wiley.com/doi/10.1111/rssc.12428,"In 2017 an estimated 3 billion people used polluting fuels and technologies as their primary cooking solution, with 3.8 million deaths annually attributed to household exposure to the resulting fine particulate matter air pollution. Currently, health burdens are calculated by using aggregations of fuel types, e.g. solid fuels, as country level estimates of the use of specific fuel types, e.g. wood and charcoal, are unavailable. To expand the knowledge base about effects of household air pollution on health, we develop and implement a novel Bayesian hierarchical model, based on generalized Dirichlet–multinomial distributions, that jointly estimates non‐linear trends in the use of eight key fuel types, overcoming several data‐specific challenges including missing or combined fuel use values. We assess model fit by using within‐sample predictive analysis and an out‐of‐sample prediction experiment to evaluate the model's forecasting performance."
6,Small sample corrections for Wald tests in latent variable models,"Brice Ozenne, Patrick M. Fisher, Esben Budtz‐J⊘rgensen",https://onlinelibrary.wiley.com/doi/10.1111/rssc.12414,"Latent variable models are commonly used in psychology and increasingly used for analysing brain imaging data. Such studies typically involve a small number of participants (n<100), where standard asymptotic results often fail to control the type 1 error appropriately. The paper presents two corrections improving the control of the type 1 error of Wald tests in latent variable models estimated by using maximum likelihood. First, we derive a correction for the bias of the maximum likelihood estimator of the variance parameters. This enables us to estimate corrected standard errors for model parameters and corrected Wald statistics. Second, we use a Student t‐distribution instead of a Gaussian distribution to account for the variability of the variance estimator. The degrees of freedom of the Student t‐distributions are estimated by using a Satterthwaite approximation. A simulation study based on data from two published brain imaging studies demonstrates that combining these two corrections provides superior control of the type 1 error rate compared with the uncorrected Wald test, despite being conservative for some parameters. The methods proposed are implemented in the R package lavaSearch2, which is available from https://cran.r-project.org/web/packages/lavaSearch2."
7,Modelling fuel injector spray characteristics in jet engines by using vine copulas,"Maximilian Coblenz, Simon Holz, Hans‐Jörg Bauer, Oliver Grothe, Rainer Koch",https://onlinelibrary.wiley.com/doi/10.1111/rssc.12421,"The emission requirements for jet engines are becoming more stringent and the combustion process determines pollutant emissions. Therefore, we model the distribution of fuel drops generated by a fuel injector in a jet engine, which can be assumed to be a five‐dimensional problem in terms of drop size, x‐position, y‐position, x‐velocity and y‐velocity. The data are generated by numerical simulations of the fuel atomization process for several jet engine operating conditions. In combustion simulations, the variables are usually assumed to be independent at the start of the simulation, which is clearly not so as our data show. The dependence between some of the variables is non‐monotone and asymmetric, which makes the modelling task difficult. Our aim is to provide a realistic parametric model for the dependence structure. For this, we employ vine copulas which provide a flexible way to construct a multivariate distribution function. However, we need to use non‐standard bivariate copulas as building blocks. Using this copula representation enables us to create realistic samples of fuel spray droplets which improve the prediction of the combustion process and the pollutant emissions. Moreover, this approach is significantly faster than solving the set of differential equations describing fuel disintegration."
8,Simulating gene silencing through intervention analysis,"Vera Djordjilović, Monica Chiogna, Chiara Romualdi",https://onlinelibrary.wiley.com/doi/10.1111/rssc.12412,"We propose a novel method for simulating the effects of gene silencing. Our approach combines relevant subject matter information provided by biological pathways with gene expression levels measured in regular conditions to predict the behaviour of the system after one of the genes has been silenced. We achieve this by modelling gene silencing as an external intervention in a causal graphical model. To account for the uncertainty that is associated with the structure learning of the graphical model, we adopt a bootstrap approach. We illustrate our proposal on a Drosophila melanogaster gene silencing experiment."
9,Global forensic geolocation with deep neural networks,"Neal S. Grantham, Brian J. Reich, Eric B. Laber, Krishna Pacifici, Robert R. Dunn, Noah Fierer, Matthew Gebert, Julia S. Allwood, Seth A. Faith",https://onlinelibrary.wiley.com/doi/10.1111/rssc.12427,"An important problem in modern forensic analyses is identifying the provenance of materials at a crime scene, such as biological material on a piece of clothing. This procedure, which is known as geolocation, is conventionally guided by expert knowledge of the biological evidence and therefore tends to be application specific, labour intensive and often subjective. Purely data‐driven methods have yet to be fully realized in this domain, because in part of the lack of a sufficiently rich source of data. However, high throughput sequencing technologies can identify tens of thousands of fungi and bacteria taxa by using DNA recovered from a single swab collected from nearly any object or surface. This microbial community, or microbiome, may be highly informative of the provenance of the sample, but data on the spatial variation of microbiomes are sparse and high dimensional and have a complex dependence structure that render them difficult to model with standard statistical tools. Deep learning algorithms have generated a tremendous amount of interest within the machine learning community for their predictive performance in high dimensional problems. We present DeepSpace: a new algorithm for geolocation that aggregates over an ensemble of deep neural network classifiers trained on randomly generated Voronoi partitions of a spatial domain. The DeepSpace algorithm makes remarkably good point predictions; for example, when applied to the microbiomes of over 1300 dust samples collected across continental USA, more than half of geolocation predictions produced by this model fall less than 100 km from their true origin, which is a 60% reduction in error from competing geolocation methods. Moreover, we apply DeepSpace to a novel data set of global dust samples collected from nearly 30 countries, finding that dust‐associated fungi alone predict a sample's country of origin with nearly 90% accuracy."
10,Fault isolation for a complex decentralized waste water treatment facility,"Molly C. Klanderman, Kathryn B. Newhart, Tzahi Y. Cath, Amanda S. Hering",https://onlinelibrary.wiley.com/doi/10.1111/rssc.12429,"Decentralized waste water treatment facilities monitor many features that are complexly related. The ability to detect the onset of a fault and to identify variables accurately that have shifted because of the fault are vital to maintaining proper system operation and high quality produced water. Various multivariate methods have been proposed to perform fault detection and isolation, but the methods require data to be independent and identically distributed when the process is in control, and most require a distributional assumption. We propose a distribution‐free retrospective change‐point‐detection method for auto‐correlated and non‐stationary multivariate processes. We detrend the data by using observations from an in‐control time period to account for expected changes due to external or user‐controlled factors. Next, we perform the fused lasso, which penalizes differences in consecutive observations, to detect faults and to identify shifted variables. To account for auto‐correlation, the regularization parameter is chosen by using an estimated effective sample size in the extended Bayesian information criterion. We demonstrate the performance of our method compared with a competitor in simulation. Finally, we apply our method to waste water treatment facility data with a known fault, and the variables identified by our proposed method are consistent with the operators’ diagnosis of the fault's cause."
11,Estimating the binary endogenous effect of insurance on doctor visits by copula‐based regression additive models,"Giampiero Marra, Rosalba Radice, David M. Zimmer",https://onlinelibrary.wiley.com/doi/10.1111/rssc.12419,"The paper estimates the causal effect of having health insurance on healthcare utilization, while accounting for potential endogeneity bias. The topic has important policy implications, because health insurance reforms implemented in the USA in recent decades have focused on extending coverage to the previously uninsured. Consequently, understanding the effects of those reforms requires an accurate estimate of the causal effect of insurance on utilization. However, obtaining such an estimate is complicated by the discreteness inherent in common measures of healthcare usage. The paper presents a flexible estimation approach, based on copula functions, that consistently estimates the coefficient of a binary endogenous regressor in count data settings. The relevant numerical computations can be easily carried out by using the freely available GJRM R package. The empirical results find significant evidence of favourable selection into insurance. Ignoring such selection, insurance appears to increase doctor visit usage by 62% but, adjusting for it, the effect increases to 134%."
12,Statistical inference on tree swallow migrations with random forests,"Tim Coleman, Lucas Mentch, Daniel Fink, Frank A. La Sorte, David W. Winkler, Giles Hooker, Wesley M. Hochachka",https://onlinelibrary.wiley.com/doi/10.1111/rssc.12416,"Bird species’ migratory patterns have typically been studied through individual observations and historical records. In recent years, the eBird citizen science project, which solicits observations from thousands of bird watchers around the world, has opened the door for a data‐driven approach to understanding the large‐scale geographical movements. Here, we focus on the North American tree swallow (Tachycineta bicolor) occurrence patterns throughout the eastern USA. Migratory departure dates for this species are widely believed by both ornithologists and casual observers to vary substantially across years, but the reasons for this are largely unknown. In this work, we present evidence that maximum daily temperature is predictive of tree swallow occurrence. Because it is generally understood that species occurrence is a function of many complex, high order interactions between ecological covariates, we utilize the flexible modelling approach that is offered by random forests. Making use of recent asymptotic results, we provide formal hypothesis tests for predictive significance of various covariates and also develop and implement a permutation‐based approach for formally assessing interannual variations by treating the prediction surfaces that are generated by random forests as functional data. Each of these tests suggest that maximum daily temperature is important in predicting migration patterns."
13,The use of sampling weights in M‐quantile random‐effects regression: an application to Programme for International Student Assessment mathematics scores,"Francesco Schirripa Spagnolo, Nicola Salvati, Antonella D’Agostino, Ides Nicaise",https://onlinelibrary.wiley.com/doi/10.1111/rssc.12418,"M‐quantile random‐effects regression represents an interesting approach for modelling multilevel data when the researcher is focused on conditional quantiles. When data are obtained from complex survey designs, sampling weights must be incorporated in the analysis. A robust pseudolikelihood approach for accommodating sampling weights in M‐quantile random‐effects regression is presented. In particular, the method is based on a robustification of the estimating equations. The methodology proposed is applied to the Italian sample of the Programme for International Student Assessment 2015 survey to study the gender gap in mathematics at various quantiles of the conditional distribution. The findings offer a possible explanation of the low proportion of women in science, technology, engineering and mathematics sectors."
14,Issue Information,no author,https://onlinelibrary.wiley.com/doi/10.1111/rssc.12360,no abstract
15,Robust and adaptive anticoagulant control,"Peter Avery, Quentin Clairon, Robin Henderson, C. James Taylor, Emma Wilson",https://onlinelibrary.wiley.com/doi/10.1111/rssc.12403,"We consider a control theory approach to adaptive dose allocation of anticoagulants, based on an analysis of records of 152 patients on long‐term warfarin treatment. We consider a selection of statistical models for the relationship between the dose of drug and subsequent blood clotting speed, measured through the international normalized ratio. Our main focus is on subsequent use of the model in guiding the choice of the next dose adaptively as patient‐specific information accrues. We compare a naive long‐term approach with a proportional‐integral‐plus method, with parameters estimated by either linear quadratic optimization or by stochastic resource allocation. We demonstrate advantages of the control approaches in comparison with a naive approach in simulations and through calculation of robust stability margins for the observed data."
16,Structured penalized regression for drug sensitivity prediction,"Zhi Zhao, Manuela Zucknick",https://onlinelibrary.wiley.com/doi/10.1111/rssc.12400,"Large‐scale in vitro drug sensitivity screens are an important tool in personalized oncology to predict the effectiveness of potential cancer drugs. The prediction of the sensitivity of cancer cell lines to a panel of drugs is a multivariate regression problem with high dimensional heterogeneous multiomics data as input data and with potentially strong correlations between the outcome variables which represent the sensitivity to the different drugs. We propose a joint penalized regression approach with structured penalty terms which enable us to utilize the correlation structure between drugs with group‐lasso‐type penalties and at the same time address the heterogeneity between ‘omics’ data sources by introducing data‐source‐specific penalty factors to penalize different data sources differently. By combining integrative penalty factors (IPFs) with the tree‐guided group lasso, we create a method called ‘IPF‐tree‐lasso’. We present a unified framework to transform more general IPF‐type methods to the original penalized method. Because the structured penalty terms have multiple parameters, we demonstrate how the interval search ‘Efficient parameter selection via global optimization’ algorithm can be used to optimize multiple penalty parameters efficiently. Simulation studies show that IPF‐tree‐lasso can improve the prediction performance compared with other lasso‐type methods, in particular for heterogeneous sources of data. Finally, we employ the new methods to analyse data from the ‘Genomics of drug sensitivity in cancer’ project."
17,Multiple imputation of binary multilevel missing not at random data,"Angelina Hammon, Sabine Zinn",https://onlinelibrary.wiley.com/doi/10.1111/rssc.12401,"We introduce a selection model‐based multilevel imputation approach to be used within the fully conditional specification framework for multiple imputation. Concretely, we apply a censored bivariate probit model to describe binary variables assumed to be missing not at random. The first equation of the model defines the regression model for the missing data mechanism. The second equation specifies the regression model of the variable to be imputed. The non‐random selection of the binary data is mapped by correlations between the error terms of the two regression models. Hierarchical data structures are modelled by random intercepts in both equations. To fit the novel imputation model we use maximum likelihood and adaptive Gauss–Hermite quadrature. A comprehensive simulation study shows the overall performance of the approach. We test its usefulness for empirical research by applying it to a common problem in social scientific research: the emergence of educational aspirations. Our software is designed to be used in the R package mice."
18,Variable selection in functional linear concurrent regression,"Rahul Ghosal, Arnab Maity, Timothy Clark, Stefano B. Longo",https://onlinelibrary.wiley.com/doi/10.1111/rssc.12408,"We propose a novel method for variable selection in functional linear concurrent regression. Our research is motivated by a fisheries footprint study where the goal is to identify important time‐varying sociostructural drivers influencing patterns of seafood consumption, and hence the fisheries footprint, over time, as well as estimating their dynamic effects. We develop a variable‐selection method in functional linear concurrent regression extending the classically used scalar‐on‐scalar variable‐selection methods like the lasso, smoothly clipped absolute deviation (SCAD) and minimax concave penalty (MCP). We show that in functional linear concurrent regression the variable‐selection problem can be addressed as a group lasso, and their natural extension: the group SCAD or a group MCP problem. Through simulations, we illustrate that our method, particularly with the group SCAD or group MCP, can pick out the relevant variables with high accuracy and has minuscule false positive and false negative rate even when data are observed sparsely, are contaminated with noise and the error process is highly non‐stationary. We also demonstrate two real data applications of our method in studies of dietary calcium absorption and fisheries footprint in the selection of influential time‐varying covariates."
19,A joint confidence region for an overall ranking of populations,"Martin Klein, Tommy Wright, Jerzy Wieczorek",https://onlinelibrary.wiley.com/doi/10.1111/rssc.12402,"National statistical agencies lack statistical methodology to express uncertainty in their released estimated overall rankings. For example, the US Census Bureau produced an ‘explicit’ ranking of the states based on observed sample estimates during 2011 of mean travel time to work. Current literature provides measures of uncertainty in estimated individual ranks, but not a direct measure of uncertainty for the estimated overall ranking. We construct and visualize a joint confidence region for the true unknown overall ranking that provides a measure of uncertainty in the estimated overall ranking."
